{
    "type": "object",
    "$schema": "http://json-schema.org/schema",
    "properties": {
        "orderAnalysisID": {
            "type": "string",
            "description": "Preferred format: yyyy-MM-dd HH:mm:ss."
        },
        "startDate": {
            "type": "string",
            "description": "Preferred format: yyyy-MM-dd HH:mm:ss."
        },
        "endDate": {
            "type": "string"
        },
        "itemCount": {
            "type": "integer",
            "description": "The final cost of the order after taxes, charges, and discounts have been applied"
        },
        "cost": {
            "type": "number",
            "description": "The total tax charged to the order."
        },
        "analysisOfPreviousYear": {
            "$ref": "orderAnalysis.json"
        },
        "orderItems": {
            "type": "array",
            "items": {
                "$ref": "orderItem.json"
            }
        }
    },
    "required": [
        "orderAnalysisID",
        "startDate",
        "endDate",
        "itemCount",
        "cost"
    ]
}