[
    {
        "orderAnalysisID": "10",
        "startDate": "2014-10-11 00:00:00",
        "endDate": "2014-10-17 00:00:00",
        "itemCount": 25,
        "cost": 1008.5,
        "analysisOfPreviousYear": {
            "orderAnalysisID": "1",
            "itemCount": 18,
            "cost": 800.2
        },
        "orderItems": []
    }
]